isbn13,isbn10,title,authors,categories,thumbnail,description,published_year,average_rating,num_pages,ratings_count,title_and_subtitle,tagged_description
9780802715401,0802715400,The -Alchemist's Kitchen,Guy Ogilvy,"Body, Mind & Spirit",http://books.google.com/books/content?id=3U3B7XPxU2sC&printsec=frontcover&img=1&zoom=1&source=gbs_api,Initiates the reader into some of the key concepts and practices of this extraordinary field of study.,2006.0,4.02,58.0,131.0,The -Alchemist's Kitchen: Extraordinary Potions & Curious Notions,9780802715401 Initiates the reader into some of the key concepts and practices of this extraordinary field of study.
9780803261839,0803261837,Pirates of Venus,Edgar Rice Burroughs,Fiction,http://books.google.com/books/content?id=PrnrGJ1F0AMC&printsec=frontcover&img=1&zoom=1&edge=curl&source=gbs_api,Astronaut Carson Napier crashes on Venus.,1934.0,3.69,179.0,1203.0,Pirates of Venus,9780803261839 Astronaut Carson Napier crashes on Venus.
9780803273320,0803273320,The Lost Continent,C. J. Cutcliffe Hyne,Fiction,http://books.google.com/books/content?id=i6nntCYCpsAC&printsec=frontcover&img=1&zoom=1&edge=curl&source=gbs_api,A fictionalized account of the last days of the doomed island of Atlantis.,2002.0,3.78,260.0,19.0,The Lost Continent: The Story of Atlantis,9780803273320 A fictionalized account of the last days of the doomed island of Atlantis.
9780803723184,0803723180,William Shakespeare's Twelfth Night,Bruce Coville;Tim Raglin,Juvenile Fiction,http://books.google.com/books/content?id=0FMIAAAACAAJ&printsec=frontcover&img=1&zoom=1&source=gbs_api,"Retells, in simplified prose, William Shakespeare's play about the misadventures which result from trickery and deceit.",2003.0,4.11,48.0,138.0,William Shakespeare's Twelfth Night,"9780803723184 Retells, in simplified prose, William Shakespeare's play about the misadventures which result from trickery and deceit."
9780803724624,0803724624,William Shakespeare's Romeo and Juliet,,Juvenile Fiction,,A simplified prose retelling of Shakespeare's play about two young people who defy their warring families' prejudices and dare to fall in love.,1999.0,3.97,40.0,175.0,William Shakespeare's Romeo and Juliet,9780803724624 A simplified prose retelling of Shakespeare's play about two young people who defy their warring families' prejudices and dare to fall in love.
9780803729780,0803729782,Time for Ballet,Adèle Geras;Shelagh McNicholas,Juvenile Fiction,http://books.google.com/books/content?id=tVoFAAAACAAJ&printsec=frontcover&img=1&zoom=1&source=gbs_api,"Tilly, who loves ballet, plays the part of a cat in her class's dance recital.",2004.0,3.71,32.0,68.0,Time for Ballet,"9780803729780 Tilly, who loves ballet, plays the part of a cat in her class's dance recital."
9780804001489,0804001480,House of Incest,Anaïs Nin,Fiction,http://books.google.com/books/content?id=G5kDYAAACAAJ&printsec=frontcover&img=1&zoom=1&source=gbs_api,"A prose poem celebrating femininity, exploring the frustrated ambitions of the writer, and describing incest.",1989.0,3.8,72.0,1774.0,House of Incest,"9780804001489 A prose poem celebrating femininity, exploring the frustrated ambitions of the writer, and describing incest."
9780804118217,0804118213,Tending Lives,Echo Heron,Medical,http://books.google.com/books/content?id=mQTd5KS2sq4C&printsec=frontcover&img=1&zoom=1&source=gbs_api,"Recounts the dramatic experiences of nurses across the country, from the bombing of the Oklahoma City federal building to a movie set",1998.0,4.27,416.0,381.0,Tending Lives: Nurses on the Medical Front,"9780804118217 Recounts the dramatic experiences of nurses across the country, from the bombing of the Oklahoma City federal building to a movie set"
9780804119184,080411918X,A Patchwork Planet,Anne Tyler,Fiction,http://books.google.com/books/content?id=1niOf6PUf1wC&printsec=frontcover&img=1&zoom=1&source=gbs_api,Follows a loveable loser and occasional thief as he tries to reform under the influence of a decent young woman.,2001.0,3.79,320.0,11090.0,A Patchwork Planet,9780804119184 Follows a loveable loser and occasional thief as he tries to reform under the influence of a decent young woman.
9780804718912,0804718911,The Consequences of Modernity,Anthony Giddens,Social Science,http://books.google.com/books/content?id=C46N9wtBI0gC&printsec=frontcover&img=1&zoom=1&source=gbs_api,Based on the Raymond Fred West memorial lectures which the author delivered at Stanford University in April 1988.,1990.0,3.79,188.0,559.0,The Consequences of Modernity,9780804718912 Based on the Raymond Fred West memorial lectures which the author delivered at Stanford University in April 1988.
9780804721288,0804721289,Taking God Out of Mathematics and Putting the Body Back in,Brian Rotman,Philosophy,http://books.google.com/books/content?id=BQujRAAACAAJ&printsec=frontcover&img=1&zoom=1&source=gbs_api,See:,1993.0,4.06,224.0,17.0,Taking God Out of Mathematics and Putting the Body Back in: An Essay in Corporeal Semiotics,9780804721288 See:
9780805016048,080501604X,The Anatomy of Human Destructiveness,Erich Fromm,Psychology,http://books.google.com/books/content?id=YjR5Ve-zTcYC&printsec=frontcover&img=1&zoom=1&source=gbs_api,"A study of man's destructive nature that utilizes evidence from psychoanalysis, neurophysiology, animal psychology, paleontology, and anthropology and is documented with clinical examples",1992.0,4.2,576.0,2104.0,The Anatomy of Human Destructiveness,"9780805016048 A study of man's destructive nature that utilizes evidence from psychoanalysis, neurophysiology, animal psychology, paleontology, and anthropology and is documented with clinical examples"
9780805031492,0805031499,Escape from Freedom,Erich Fromm,Political Science,http://books.google.com/books/content?id=d2g8L1sLykwC&printsec=frontcover&img=1&zoom=1&source=gbs_api,The author analyzes what he considers to be contemporary man's fear of positive freedom and willingness to submit to totalitarianism.,1994.0,4.24,301.0,6825.0,Escape from Freedom,9780805031492 The author analyzes what he considers to be contemporary man's fear of positive freedom and willingness to submit to totalitarianism.
9780805063745,0805063749,The Milagro Beanfield War,John Nichols,Fiction,http://books.google.com/books/content?id=Wf_wiwuNuOQC&printsec=frontcover&img=1&zoom=1&source=gbs_api,Violence erupts in the poor town of Milagro when one poor dirt farmer impulsively taps the main irrigation channel. Reprint.,2000.0,4.09,456.0,8841.0,The Milagro Beanfield War: A Novel,9780805063745 Violence erupts in the poor town of Milagro when one poor dirt farmer impulsively taps the main irrigation channel. Reprint.
9780805069495,0805069496,Ulysses S. Grant,Josiah Bunting,Biography & Autobiography,http://books.google.com/books/content?id=ZAGreVhVQPgC&printsec=frontcover&img=1&zoom=1&source=gbs_api,Traces the life and presidency of Ulyssses S. Grant and discusses why he was undervalued as a president.,2004.0,3.85,208.0,391.0,"Ulysses S. Grant: The American Presidents Series: The 18th President, 1869-1877",9780805069495 Traces the life and presidency of Ulyssses S. Grant and discusses why he was undervalued as a president.
9780805079135,0805079130,Saint-Exupery,Stacy Schiff,Biography & Autobiography,http://books.google.com/books/content?id=h-gk5R0OmI0C&printsec=frontcover&img=1&zoom=1&source=gbs_api,"Traces the life of the French author and pilot, depicts his complex personality, and looks at his contributions to the war effort.",2006.0,4.05,560.0,195.0,Saint-Exupery: A Biography,"9780805079135 Traces the life of the French author and pilot, depicts his complex personality, and looks at his contributions to the war effort."
9780805080490,080508049X,The Black Cauldron,Lloyd Alexander,Juvenile Fiction,http://books.google.com/books/content?id=tbwsTtuHmX4C&printsec=frontcover&img=1&zoom=1&source=gbs_api,The land of Prydain is threatened by the evil Arawn and his band of invincible warriors.,2006.0,4.14,182.0,51994.0,The Black Cauldron,9780805080490 The land of Prydain is threatened by the evil Arawn and his band of invincible warriors.
9780805209068,0805209069,The diaries,Franz Kafka,Biography & Autobiography,http://books.google.com/books/content?id=j6WIHMphOD4C&printsec=frontcover&img=1&zoom=1&source=gbs_api,Journal entries share Kafka's thoughts and observations during the ten years before his death,1988.0,4.23,521.0,2028.0,The diaries: 1910-1923,9780805209068 Journal entries share Kafka's thoughts and observations during the ten years before his death
9780805210552,0805210555,The Complete Stories,Franz Kafka,Fiction,http://books.google.com/books/content?id=ATl4i59stCMC&printsec=frontcover&img=1&zoom=1&source=gbs_api,"Collects the entire body of Kafka's short stories and parables, reflecting his concern for modern man's search for identity, place, and purpose",1995.0,4.35,486.0,19625.0,The Complete Stories,"9780805210552 Collects the entire body of Kafka's short stories and parables, reflecting his concern for modern man's search for identity, place, and purpose"
9780805210774,0805210776,"The Magic Orange Tree, and Other Haitian Folktales",Diane Wolkstein;Elsa Henriquez,Fiction,http://books.google.com/books/content?id=T_gDAAAACAAJ&printsec=frontcover&img=1&zoom=1&source=gbs_api,A collection of folktales gathered by the author in Haiti with comments on Haitian folklore.,1978.0,4.16,224.0,120.0,"The Magic Orange Tree, and Other Haitian Folktales",9780805210774 A collection of folktales gathered by the author in Haiti with comments on Haitian folklore.
9780805350869,0805350861,The Anatomy Coloring Book,Wynn Kapit;Lawrence M. Elson,Science,http://books.google.com/books/content?id=gt0jRUTABWQC&printsec=frontcover&img=1&zoom=1&source=gbs_api,Includes bibliographical references and index,2002.0,4.25,400.0,1620.0,The Anatomy Coloring Book,9780805350869 Includes bibliographical references and index
9780805420432,0805420436,Letters to Children,Clive Staples Lewis,Religion,http://books.google.com/books/content?id=jfRfxAEACAAJ&printsec=frontcover&img=1&zoom=1&source=gbs_api,A collection of letters from the English author of the Narnia books to a variety of children.,1985.0,4.18,128.0,1581.0,Letters to Children,9780805420432 A collection of letters from the English author of the Narnia books to a variety of children.
9780806127941,0806127945,Warfare in the Classical World,John Gibson Warry,History,http://books.google.com/books/content?id=TFTIQgAACAAJ&printsec=frontcover&img=1&zoom=1&source=gbs_api,Traces the evolution of the art of warfare in the Greek and Roman worlds between 1600 BC and AD 800.,1995.0,4.13,224.0,371.0,"Warfare in the Classical World: An Illustrated Encyclopedia of Weapons, Warriors, and Warfare in the Ancient Civilisations of Greece and Rome",9780806127941 Traces the evolution of the art of warfare in the Greek and Roman worlds between 1600 BC and AD 800.
9780806132297,0806132299,Regeneration Through Violence,Richard Slotkin,Literary Criticism,http://books.google.com/books/content?id=552NfCm3-WwC&printsec=frontcover&img=1&zoom=1&edge=curl&source=gbs_api,"Originally published: Middletown, Conn.: Wesleyan University Press, 1973.",2000.0,4.28,670.0,157.0,"Regeneration Through Violence: The Mythology of the American Frontier, 1600-1860","9780806132297 Originally published: Middletown, Conn.: Wesleyan University Press, 1973."
9780806519609,0806519606,Wizard,Marc J. Seifer,Biography & Autobiography,http://books.google.com/books/content?id=_EKV1A22x0sC&printsec=frontcover&img=1&zoom=1&source=gbs_api,Original material and recently acquired documents form the foundation of a biography of the man who served as an inspiration for modern electrical inventions,1998.0,3.77,542.0,2613.0,Wizard: The Life and Times of Nikola Tesla : Biography of a Genius,9780806519609 Original material and recently acquired documents form the foundation of a biography of the man who served as an inspiration for modern electrical inventions
9780806930770,0806930772,Edward Lear,Edward Lear,Juvenile Nonfiction,http://books.google.com/books/content?id=OOWdcHG1oXwC&printsec=frontcover&img=1&zoom=1&edge=curl&source=gbs_api,An illustrated collection of rhyming poems by Edward Lear.,2001.0,3.9,48.0,64.0,Edward Lear,9780806930770 An illustrated collection of rhyming poems by Edward Lear.
9780807014271,0807014273,Man's Search for Meaning,Viktor Emil Frankl,Biography & Autobiography,http://books.google.com/books/content?id=F-Q_xGjWBi8C&printsec=frontcover&img=1&zoom=1&edge=curl&source=gbs_api,"Viennese psychiatrist tells his grim experiences in a German concentration camp which led him to logotherapy, an existential method of psychiatry.",2006.0,4.36,165.0,2624.0,Man's Search for Meaning,"9780807014271 Viennese psychiatrist tells his grim experiences in a German concentration camp which led him to logotherapy, an existential method of psychiatry."
9780807064733,0807064734,The Poetics of Space,Gaston Bachelard,Philosophy,http://books.google.com/books/content?id=BxNIdGr_FOwC&printsec=frontcover&img=1&zoom=1&source=gbs_api,"Shows how our perceptions of home shape our thoughts, memories, and dreams, and discusses each space from cellar to attic",1994.0,4.19,282.0,6625.0,The Poetics of Space,"9780807064733 Shows how our perceptions of home shape our thoughts, memories, and dreams, and discusses each space from cellar to attic"
9780807123331,0807123331,The Collected Poems of Robert Penn Warren,Robert Penn Warren;John Burt,Poetry,http://books.google.com/books/content?id=tBMN6gmiA6EC&printsec=frontcover&img=1&zoom=1&edge=curl&source=gbs_api,?,1998.0,4.37,838.0,170.0,The Collected Poems of Robert Penn Warren,9780807123331 ?
9780807555385,080755538X,The Midnight Mystery (The Boxcar Children Mysteries #95),Gertrude Chandler Warner,Juvenile Fiction,http://books.google.com/books/content?id=fNTJrHKXrWEC&printsec=frontcover&img=1&zoom=1&source=gbs_api,The Alden children are investigating a mysterious tapping sound at midnight in the home of a famous inventor known for her one-of-a-kind clocks.,2003.0,3.94,128.0,296.0,The Midnight Mystery (The Boxcar Children Mysteries #95),9780807555385 The Alden children are investigating a mysterious tapping sound at midnight in the home of a famous inventor known for her one-of-a-kind clocks.
9780807588970,0807588970,When I Feel Angry,Cornelia Maude Spelman,Juvenile Fiction,http://books.google.com/books/content?id=tE31J75ZfmcC&printsec=frontcover&img=1&zoom=1&source=gbs_api,A little rabbit describes what makes her angry and the different ways she can control her anger.,2000.0,3.99,24.0,108.0,When I Feel Angry,9780807588970 A little rabbit describes what makes her angry and the different ways she can control her anger.
9780807840894,0807840890,Allusions in Ulysses,Weldon Thornton,Literary Criticism,http://books.google.com/books/content?id=Dof6ABIIfwkC&printsec=frontcover&img=1&zoom=1&edge=curl&source=gbs_api,Allusions in Ulysses: An Annotated List,1982.0,4.04,563.0,22.0,Allusions in Ulysses: An Annotated List,9780807840894 Allusions in Ulysses: An Annotated List
9780807847237,0807847232,"The Creation of the American Republic, 1776-1787",Gordon S. Wood,Political science,http://books.google.com/books/content?id=9xURxgEACAAJ&printsec=frontcover&img=1&zoom=1&source=gbs_api,Illuminates the concepts of the Constitution by studying the cultural situation of the colonists.,1998.0,4.12,675.0,1722.0,"The Creation of the American Republic, 1776-1787",9780807847237 Illuminates the concepts of the Constitution by studying the cultural situation of the colonists.
9780810957800,0810957809,Babar's World Tour,Laurent de Brunhoff,Juvenile Fiction,http://books.google.com/books/content?id=RnNaAAAAYAAJ&printsec=frontcover&img=1&zoom=1&source=gbs_api,Babar and his family take a trip around the world.,2005.0,3.84,48.0,65.0,Babar's World Tour,9780810957800 Babar and his family take a trip around the world.
9780810958623,0810958627,Ruby Gloom's Guide to Friendship,Mighty Fine Inc.,Juvenile Nonfiction,http://books.google.com/books/content?id=FYrcurhzrk8C&printsec=frontcover&img=1&zoom=1&source=gbs_api,"If Ruby Gloom's friends seem somewhat unusual, ""well then, welcome to Gloomsville, where being different IS normal.""",2005.0,4.34,72.0,37.0,Ruby Gloom's Guide to Friendship,"9780810958623 If Ruby Gloom's friends seem somewhat unusual, ""well then, welcome to Gloomsville, where being different IS normal."""
9780810982192,0810982196,National Geographic Society,C. D.B. Bryan,Photography,http://books.google.com/books/content?id=S61TPgAACAAJ&printsec=frontcover&img=1&zoom=1&source=gbs_api,"In this celebratory volume, award-winning author Bryan brings the Society's legacy to life with stunning photos and dramatic accounts. 444 illustrations.",2001.0,4.12,528.0,10.0,National Geographic Society: 100 Years of Adventure and Discovery,"9780810982192 In this celebratory volume, award-winning author Bryan brings the Society's legacy to life with stunning photos and dramatic accounts. 444 illustrations."
9780811200707,0811200701,The Berlin Stories,Christopher Isherwood,Fiction,http://books.google.com/books/content?id=TL882wBAzjsC&printsec=frontcover&img=1&zoom=1&edge=curl&source=gbs_api,"The Sally Bowles character was the subject of a play, I am a camera; and a musical, Cabaret.",1963.0,4.03,401.0,8749.0,The Berlin Stories,"9780811200707 The Sally Bowles character was the subject of a play, I am a camera; and a musical, Cabaret."
9780811201063,0811201066,The Air-conditioned Nightmare,Henry Miller,Fiction,http://books.google.com/books/content?id=jAEY3Kbnj3oC&printsec=frontcover&img=1&zoom=1&edge=curl&source=gbs_api,"Presents the contemporary writer's vision of American life, gleaned from his travels throughout the country during the early 1940's",1970.0,3.83,292.0,2627.0,The Air-conditioned Nightmare,"9780811201063 Presents the contemporary writer's vision of American life, gleaned from his travels throughout the country during the early 1940's"
9780811208994,0811208990,Selected Poems,Octavio Paz;G. Aroul,Poetry,http://books.google.com/books/content?id=b_EgaARVgNYC&printsec=frontcover&img=1&zoom=1&edge=curl&source=gbs_api,"Poems deal with death, nature, the past, art, perception, love, travel, communication, and truth",1984.0,4.21,160.0,359.0,Selected Poems,"9780811208994 Poems deal with death, nature, the past, art, perception, love, travel, communication, and truth"
9780811209052,0811209059,Seven Nights,Jorge Luis Borges,Literary Collections,http://books.google.com/books/content?id=ty8LLZ_U93MC&printsec=frontcover&img=1&zoom=1&edge=curl&source=gbs_api,"Lectures discuss The Divine Comedy, nightmares, The Thousand and One Nights, Buddhism, poetry, the Kabbalah, and blindness",1984.0,4.33,121.0,988.0,Seven Nights,"9780811209052 Lectures discuss The Divine Comedy, nightmares, The Thousand and One Nights, Buddhism, poetry, the Kabbalah, and blindness"
9780811212472,0811212475,The Crack-up,Francis Scott Fitzgerald,Literary Collections,http://books.google.com/books/content?id=B8saLwl-2TEC&printsec=frontcover&img=1&zoom=1&edge=curl&source=gbs_api,(Autobiographical).,1993.0,3.92,347.0,2410.0,The Crack-up,9780811212472 (Autobiographical).
9780811214001,0811214001,Everything and Nothing,Jorge Luis Borges,Literary Collections,http://books.google.com/books/content?id=8EMSAEfXzk0C&printsec=frontcover&img=1&zoom=1&edge=curl&source=gbs_api,"""Some of the most witty, uncannily original short fiction in Western Literature."" The New Yorker""",1999.0,4.37,108.0,554.0,Everything and Nothing,"9780811214001 ""Some of the most witty, uncannily original short fiction in Western Literature."" The New Yorker"""
9780811214988,0811214982,The Red Notebook,Paul Auster,Fiction,http://books.google.com/books/content?id=Re7WYDC4URQC&printsec=frontcover&img=1&zoom=1&edge=curl&source=gbs_api,Contains: The red notebook -- Why write? -- Accident report -- It don't mean a thing.,2002.0,3.77,104.0,2306.0,The Red Notebook: True Stories,9780811214988 Contains: The red notebook -- Why write? -- Accident report -- It don't mean a thing.
9780811216227,0811216225,The Selected Poems of Federico García Lorca,Federico García Lorca,Poetry,http://books.google.com/books/content?id=XKcd-MOPnR4C&printsec=frontcover&img=1&zoom=1&edge=curl&source=gbs_api,A reissue of a landmark poetry volume with a new introduction by Pulitzer Prize winner W. S. Merwin. Bilingual.,2005.0,4.31,186.0,6163.0,The Selected Poems of Federico García Lorca,9780811216227 A reissue of a landmark poetry volume with a new introduction by Pulitzer Prize winner W. S. Merwin. Bilingual.
9780811216746,0811216748,Laughter in the Dark,Vladimir Nabokov;Vladimir Vladimirovich Nabokov;John Banville,Fiction,http://books.google.com/books/content?id=4uj1Dy_P_YQC&printsec=frontcover&img=1&zoom=1&edge=curl&source=gbs_api,Tragedy of a rich and respectable Berlin art dealer and his passion for his young mistress.,1960.0,3.96,292.0,8233.0,Laughter in the Dark,9780811216746 Tragedy of a rich and respectable Berlin art dealer and his passion for his young mistress.
9780811821841,0811821846,Wookiee Cookies,Robin Davis,Cooking,http://books.google.com/books/content?id=xmKf7BnQiqMC&printsec=frontcover&img=1&zoom=1&source=gbs_api,"A cookbook with a Star Wars theme includes such recipes as crazy cantina chili, Boba Fett-uccine, and C-3PO pancakes.",1998.0,3.92,132.0,916.0,Wookiee Cookies: A Star Wars Cookbook,"9780811821841 A cookbook with a Star Wars theme includes such recipes as crazy cantina chili, Boba Fett-uccine, and C-3PO pancakes."
9780811824545,0811824543,The Campfire Collection,Eric Martin,Fiction,http://books.google.com/books/content?id=r0N2xgEACAAJ&printsec=frontcover&img=1&zoom=1&source=gbs_api,A collection of tales designed to be told around a campfire.,2000.0,3.25,176.0,48.0,The Campfire Collection: Spine-tingling Tales to Tell in the Dark,9780811824545 A collection of tales designed to be told around a campfire.
9780811839747,0811839745,Chicago Stories,John Miller;Genevieve Morgan,Fiction,http://books.google.com/books/content?id=SeGcZgcmFUYC&printsec=frontcover&img=1&zoom=1&source=gbs_api,"A selection of stories, articles, poems, and excerpts from longer works about Chicago by Saul Bellow, Eliot Ness, Edna Ferber, Langston Hughes, and others.",2003.0,3.56,224.0,44.0,Chicago Stories: Tales of the City,"9780811839747 A selection of stories, articles, poems, and excerpts from longer works about Chicago by Saul Bellow, Eliot Ness, Edna Ferber, Langston Hughes, and others."
9780811850995,0811850994,Vincent's Colors,"Metropolitan Museum of Art (New York, N.Y.)",Juvenile Nonfiction,http://books.google.com/books/content?id=fnvzBjc_TTMC&printsec=frontcover&img=1&zoom=1&source=gbs_api,"Combines van Gogh's paintings with his own words, describing each work of art and introducing young readers to the concept of color.",2005.0,4.16,48.0,305.0,Vincent's Colors,"9780811850995 Combines van Gogh's paintings with his own words, describing each work of art and introducing young readers to the concept of color."
9780811853194,0811853195,I Am 8-bit,Jon M. Gibson,Art,http://books.google.com/books/content?id=dO-sDl1ySHoC&printsec=frontcover&img=1&zoom=1&source=gbs_api,"Showcases the work of seventy artists, including painters, designers, cartoonists, sculptors, and illustrators, whose works feature their favorite video games from the 1980s.",2006.0,4.09,156.0,117.0,I Am 8-bit: Art Inspired by Classic Videogames of the '80s,"9780811853194 Showcases the work of seventy artists, including painters, designers, cartoonists, sculptors, and illustrators, whose works feature their favorite video games from the 1980s."
9780812000399,0812000390,Chaucer's Canterbury Tales (Selected),Geoffrey Chaucer;Vincent F. Hopper,Literary Collections,http://books.google.com/books/content?id=u71rxf02d8IC&printsec=frontcover&img=1&zoom=1&source=gbs_api,"Each line of the original Middle English is followed by a line of modern English ""translation."" Includes biography of Chaucer, interpretive introduction.",1977.0,3.75,530.0,69.0,Chaucer's Canterbury Tales (Selected): An Interlinear Translation,"9780812000399 Each line of the original Middle English is followed by a line of modern English ""translation."" Includes biography of Chaucer, interpretive introduction."
9780812211122,081221112X,Forms of Talk,Erving Goffman,Language Arts & Disciplines,http://books.google.com/books/content?id=Z3bvx_T4Zu8C&printsec=frontcover&img=1&zoom=1&edge=curl&source=gbs_api,"This book brings together five of Goffman's seminal essays: ""Replies and Responses,"" ""Response Cries,"" ""Footing,"" ""The Lecture,"" and ""Radio Talk.""",1981.0,3.81,344.0,77.0,Forms of Talk,"9780812211122 This book brings together five of Goffman's seminal essays: ""Replies and Responses,"" ""Response Cries,"" ""Footing,"" ""The Lecture,"" and ""Radio Talk."""
9780812217759,0812217756,The Negro,W. E. B. Du Bois,History,http://books.google.com/books/content?id=h1RRPJSaThsC&printsec=frontcover&img=1&zoom=1&source=gbs_api,A classic rediscovered.,2001.0,4.31,284.0,29.0,The Negro,9780812217759 A classic rediscovered.
9780812416114,0812416112,Lord of the Flies,William Golding,Fiction,http://books.google.com/books/content?id=2DAZmQEACAAJ&printsec=frontcover&img=1&zoom=1&source=gbs_api,Story of the return to the wild of a group of British schoolboys marooned on an island.,1959.0,3.67,208.0,310.0,Lord of the Flies,9780812416114 Story of the return to the wild of a group of British schoolboys marooned on an island.
9780812504675,0812504674,The Invisible Man,H. G. Wells,Fiction,http://books.google.com/books/content?id=2bLt-sGupm0C&printsec=frontcover&img=1&zoom=1&source=gbs_api,The English village of Bramblehurst is intimidated by a mysterious stranger whose face is completely wrapped in bandages,1992.0,3.63,178.0,293.0,The Invisible Man,9780812504675 The English village of Bramblehurst is intimidated by a mysterious stranger whose face is completely wrapped in bandages
