isbn13,isbn10,title,authors,categories,thumbnail,description,published_year,average_rating,num_pages,ratings_count,title_and_subtitle,tagged_description
9780375701894,0375701893,Tell Me how Long the Train's Been Gone,James Baldwin,Fiction,http://books.google.com/books/content?id=CwePDQAAQBAJ&printsec=frontcover&img=1&zoom=1&source=gbs_api,"Leo Proudhammer, an African American actor, reminisces about his past life and loves, while lying in the hospital, recovering from a heart attack",1998.0,4.25,496.0,2013.0,Tell Me how Long the Train's Been Gone: A Novel,"9780375701894 Leo Proudhammer, an African American actor, reminisces about his past life and loves, while lying in the hospital, recovering from a heart attack"
9780375701962,0375701966,The Moviegoer,Walker Percy,Fiction,http://books.google.com/books/content?id=9ShhHmdoSF0C&printsec=frontcover&img=1&zoom=1&source=gbs_api,Kate's desperate struggle to maintain her sanity forces her cousin Binx to relinquish his dreamworld,1998.0,3.69,242.0,20796.0,The Moviegoer,9780375701962 Kate's desperate struggle to maintain her sanity forces her cousin Binx to relinquish his dreamworld
9780375702365,0375702369,The World and Other Places,Jeanette Winterson,Fiction,http://books.google.com/books/content?id=OMs_PgAACAAJ&printsec=frontcover&img=1&zoom=1&source=gbs_api,Presents a collection of seventeen stories spanning the author's career.,2000.0,3.87,240.0,1918.0,The World and Other Places,9780375702365 Presents a collection of seventeen stories spanning the author's career.
9780375703065,0375703063,A Virtuous Woman,Kaye Gibbons,Fiction,http://books.google.com/books/content?id=WJtoSTRcIYcC&printsec=frontcover&img=1&zoom=1&source=gbs_api,"In alternating chapters, two ill-matched people--Jack Ernest Stokes and his wife, Ruby Pitt Woodrow Stokes--describe their lives together and apart",1997.0,3.68,165.0,22632.0,A Virtuous Woman,"9780375703065 In alternating chapters, two ill-matched people--Jack Ernest Stokes and his wife, Ruby Pitt Woodrow Stokes--describe their lives together and apart"
9780375705045,037570504X,"Breath, Eyes, Memory",Edwidge Danticat,Fiction,http://books.google.com/books/content?id=p59DpQ14VEQC&printsec=frontcover&img=1&zoom=1&source=gbs_api,Oprah's Book Club.,1998.0,3.87,234.0,24348.0,"Breath, Eyes, Memory",9780375705045 Oprah's Book Club.
9780375708732,0375708731,American Chronicle,Gore Vidal,Vice-Presidents,,"A fictional memoir illuminating Aaron Burr's life and times, highlighting his political accomplishments and fatal duel with Alexander Hamilton.",2000.0,4.07,430.0,6921.0,American Chronicle: Burr : a Novel,"9780375708732 A fictional memoir illuminating Aaron Burr's life and times, highlighting his political accomplishments and fatal duel with Alexander Hamilton."
9780375719004,0375719008,The Adolescent,Fyodor Dostoyevsky,Fiction,http://books.google.com/books/content?id=nKJ27jiKJK4C&printsec=frontcover&img=1&zoom=1&source=gbs_api,Nineteen-year-old Arkady Dolgonsky has difficulty establishing his personal identity amid the political and social upheavals of nineteenth-century Russia.,2004.0,3.94,647.0,3403.0,The Adolescent,9780375719004 Nineteen-year-old Arkady Dolgonsky has difficulty establishing his personal identity amid the political and social upheavals of nineteenth-century Russia.
9780375724374,0375724370,Anil's Ghost,Michael Ondaatje,Fiction,http://books.google.com/books/content?id=a8ekIHXd0LkC&printsec=frontcover&img=1&zoom=1&source=gbs_api,A forensic pathologist returns to Sri Lanka--after 15 years abroad--to assist in identifying victims of the country's civil war.,2001.0,3.56,311.0,12507.0,Anil's Ghost,9780375724374 A forensic pathologist returns to Sri Lanka--after 15 years abroad--to assist in identifying victims of the country's civil war.
9780375724428,0375724427,The Stories of John Cheever,John Cheever,United States,http://books.google.com/books/content?id=W959yAEACAAJ&printsec=frontcover&img=1&zoom=1&source=gbs_api,"A collection of sixty-one of Cheever's short stories, including four that have never been published in book form.",1978.0,4.27,693.0,12040.0,The Stories of John Cheever,"9780375724428 A collection of sixty-one of Cheever's short stories, including four that have never been published in book form."
9780375724503,0375724508,Ghostwritten,David Mitchell,Fiction,http://books.google.com/books/content?id=-tRumAEACAAJ&printsec=frontcover&img=1&zoom=1&source=gbs_api,The lives of nine total strangers from nine different countries become intertwined in a strange series of circumstances.,2001.0,4.06,426.0,20093.0,Ghostwritten: A Novel,9780375724503 The lives of nine total strangers from nine different countries become intertwined in a strange series of circumstances.
9780375751516,0375751513,The Picture of Dorian Gray,Oscar Wilde,Fiction,http://books.google.com/books/content?id=kIcZKBNaQtIC&printsec=frontcover&img=1&zoom=1&source=gbs_api,The handsome appearance of dissolute young Dorian Gray remains unchanged while the features in his portrait become distorted as his degeneration progresses,1998.0,4.07,367.0,705175.0,The Picture of Dorian Gray,9780375751516 The handsome appearance of dissolute young Dorian Gray remains unchanged while the features in his portrait become distorted as his degeneration progresses
9780375752674,0375752676,Iceland,David Roberts;Jon Krakauer,Travel,http://books.google.com/books/content?id=-VAEAAAACAAJ&printsec=frontcover&img=1&zoom=1&source=gbs_api,Photographs exploring the grandeur of Iceland's remarkable geography accompany tales of real-life heroes and supernatural beings,1998.0,3.72,160.0,315.0,Iceland: Land of the Sagas,9780375752674 Photographs exploring the grandeur of Iceland's remarkable geography accompany tales of real-life heroes and supernatural beings
9780375753107,0375753109,Sodom and Gomorrah,Marcel Proust,Fiction,http://books.google.com/books/content?id=4lmMxgEACAAJ&printsec=frontcover&img=1&zoom=1&source=gbs_api,"A revised translation of the final volume in Proust's ""In Search of Lost Time"" series",1992.0,4.36,784.0,354.0,Sodom and Gomorrah,"9780375753107 A revised translation of the final volume in Proust's ""In Search of Lost Time"" series"
9780375755200,0375755209,Nine Horses,Billy Collins,Poetry,http://books.google.com/books/content?id=wZRBDwAAQBAJ&printsec=frontcover&img=1&zoom=1&source=gbs_api,A collection of poems offers reflections on the mystery and beauty found in everyday life.,2003.0,4.17,144.0,4048.0,Nine Horses: Poems,9780375755200 A collection of poems offers reflections on the mystery and beauty found in everyday life.
9780375757013,0375757015,Great Expectations,Charles Dickens,Fiction,http://books.google.com/books/content?id=6regVx_CnxgC&printsec=frontcover&img=1&zoom=1&source=gbs_api,"Presents the classic story of the orphan Pip, the convict Magwitch, the beautiful Estella, and her guardian, the embittered Miss Havisham.",2001.0,3.76,480.0,355.0,Great Expectations,"9780375757013 Presents the classic story of the orphan Pip, the convict Magwitch, the beautiful Estella, and her guardian, the embittered Miss Havisham."
9780375757181,037575718X,The Return of the Native,Thomas Hardy,Fiction,http://books.google.com/books/content?id=sfVxn1EOELQC&printsec=frontcover&img=1&zoom=1&source=gbs_api,Presents Hardy's classic novel of two people caught up in their passion for each other and conflicting ambitions.,1994.0,3.85,448.0,28843.0,The Return of the Native,9780375757181 Presents Hardy's classic novel of two people caught up in their passion for each other and conflicting ambitions.
9780375757990,0375757996,The Basic Works of Aristotle,Aristotle,Philosophy,http://books.google.com/books/content?id=ykGPjLgScUEC&printsec=frontcover&img=1&zoom=1&source=gbs_api,Examines the pervading influence of this eminent Greek philosopher through a collection of his major works.,2001.0,4.24,1487.0,2116.0,The Basic Works of Aristotle,9780375757990 Examines the pervading influence of this eminent Greek philosopher through a collection of his major works.
9780375759147,037575914X,Little Dorrit,Charles Dickens,Fiction,http://books.google.com/books/content?id=5NOm7uAbWIcC&printsec=frontcover&img=1&zoom=1&source=gbs_api,The daughter of an imprisoned debtor suffers injustices of nineteenth-century English society.,2002.0,3.98,1347.0,286.0,Little Dorrit,9780375759147 The daughter of an imprisoned debtor suffers injustices of nineteenth-century English society.
9780375760648,0375760644,War and Peace,graf Leo Tolstoy,Fiction,http://books.google.com/books/content?id=MNQK8uDk5F4C&printsec=frontcover&img=1&zoom=1&source=gbs_api,The monumental Russian classic reflects the life and times of Russian society during the Napoleonic War.,2002.0,4.11,1388.0,830.0,War and Peace,9780375760648 The monumental Russian classic reflects the life and times of Russian society during the Napoleonic War.
9780375760815,0375760814,Savage Beauty,Nancy Milford,Biography & Autobiography,http://books.google.com/books/content?id=kP_N1vyWS4IC&printsec=frontcover&img=1&zoom=1&source=gbs_api,"An authorized portrait of the Pulitzer Prize-winning poet draws on Millay's intimate diary, letters, and other papers to capture her flamboyant and turbulent life.",2002.0,4.01,608.0,6672.0,Savage Beauty: The Life of Edna St. Vincent Millay,"9780375760815 An authorized portrait of the Pulitzer Prize-winning poet draws on Millay's intimate diary, letters, and other papers to capture her flamboyant and turbulent life."
9780375802430,0375802436,Flap Your Wings,,Juvenile Fiction,http://books.google.com/books/content?id=yK46lkqpJ1cC&printsec=frontcover&img=1&zoom=1&source=gbs_api,"Two birds unwittingly hatch an alligator egg, which has been accidently placed in their nest, and then try to teach their ""son"" to fly.",2000.0,4.24,48.0,1228.0,Flap Your Wings,"9780375802430 Two birds unwittingly hatch an alligator egg, which has been accidently placed in their nest, and then try to teach their ""son"" to fly."
9780375813689,0375813683,The School Skeleton,Ron Roy,Juvenile Fiction,http://books.google.com/books/content?id=u8tvDwAAQBAJ&printsec=frontcover&img=1&zoom=1&source=gbs_api,"At Green Lawn Elementary, the entire school becomes involved in a mystery when Mr. Bones, the skeleton in the nurse's office, disappears.",2003.0,3.99,96.0,1759.0,The School Skeleton,"9780375813689 At Green Lawn Elementary, the entire school becomes involved in a mystery when Mr. Bones, the skeleton in the nurse's office, disappears."
9780375822971,0375822976,Big Dog ... Little Dog,,Juvenile Fiction,http://books.google.com/books/content?id=O8haAAAAYAAJ&printsec=frontcover&img=1&zoom=1&source=gbs_api,Two dogs are opposite in every way but are the very best of friends.,2003.0,4.11,48.0,86.0,Big Dog ... Little Dog,9780375822971 Two dogs are opposite in every way but are the very best of friends.
9780375823022,0375823026,"Junie B., First Grader",Barbara Park,Juvenile Fiction,http://books.google.com/books/content?id=5tiyVWEjVPcC&printsec=frontcover&img=1&zoom=1&source=gbs_api,"When her father will not let her stay up late to do her homework, first grader Junie B. copies a classmate's paper.",2003.0,4.03,86.0,103.0,"Junie B., First Grader: Cheater Pants","9780375823022 When her father will not let her stay up late to do her homework, first grader Junie B. copies a classmate's paper."
9780375828256,0375828257,The People of Sparks,Jeanne DuPrau,Juvenile Fiction,http://books.google.com/books/content?id=dqkPWhBz73cC&printsec=frontcover&img=1&zoom=1&source=gbs_api,"Having escaped to the Unknown Regions, Lina and the others seek help from the village people of Sparks.",2005.0,3.66,338.0,44751.0,The People of Sparks,"9780375828256 Having escaped to the Unknown Regions, Lina and the others seek help from the village people of Sparks."
9780375832208,0375832203,Ancient Rome and Pompeii,Mary Pope Osborne;Natalie Pope Boyce,Juvenile Nonfiction,http://books.google.com/books/content?id=QCSOlsXtnu0C&printsec=frontcover&img=1&zoom=1&source=gbs_api,Provides information on the extinct city of Pompeii and life in ancient Rome.,2006.0,4.07,128.0,644.0,Ancient Rome and Pompeii: A Nonfiction Companion to Magic Tree House #13: Vacation Under the Volcano,9780375832208 Provides information on the extinct city of Pompeii and life in ancient Rome.
9780375832215,0375832211,Tsunamis and Other Natural Disasters,Mary Pope Osborne;Natalie Pope Boyce,Juvenile Nonfiction,http://books.google.com/books/content?id=fa_tZJwM8W4C&printsec=frontcover&img=1&zoom=1&source=gbs_api,"Designed for younger readers, this is an informative, fact-filled guide to all kinds of natural disasters.",2007.0,4.04,128.0,445.0,"Tsunamis and Other Natural Disasters: A Nonfiction Companion to Magic Tree House #28, High Tide in Hawaii","9780375832215 Designed for younger readers, this is an informative, fact-filled guide to all kinds of natural disasters."
9780375836046,0375836047,Toys Go Out,Emily Jenkins,Juvenile Fiction,http://books.google.com/books/content?id=EpdjRYENHLYC&printsec=frontcover&img=1&zoom=1&source=gbs_api,"Six stories relate the adventures of three best friends, who happen to be toys.",2006.0,3.93,116.0,3861.0,"Toys Go Out: Being the Adventures of a Knowledgeable Stingray, a Toughy Little Buffalo, And Someone Called Plastic","9780375836046 Six stories relate the adventures of three best friends, who happen to be toys."
9780375836572,0375836578,The Realm of Possibility,David Levithan,Juvenile Fiction,http://books.google.com/books/content?id=FXl4Nc1GnSQC&printsec=frontcover&img=1&zoom=1&source=gbs_api,"A variety of students at the same high school describe their ideas, experiences, and relationships in a series of interconnected free verse stories.",2006.0,3.93,210.0,14438.0,The Realm of Possibility,"9780375836572 A variety of students at the same high school describe their ideas, experiences, and relationships in a series of interconnected free verse stories."
9780375839375,0375839372,Mayflower Treasure Hunt,Ron Roy,Juvenile Fiction,http://books.google.com/books/content?id=1DCQ-_PWKksC&printsec=frontcover&img=1&zoom=1&source=gbs_api,"When Dink, Josh, and Ruth Rose visit Plymouth, Massachusetts for Thanksgiving, they uncover a mystery that dates back to the landing of the Pilgrims.",2007.0,4.18,114.0,926.0,Mayflower Treasure Hunt,"9780375839375 When Dink, Josh, and Ruth Rose visit Plymouth, Massachusetts for Thanksgiving, they uncover a mystery that dates back to the landing of the Pilgrims."
9780380004614,0380004615,Ox,Piers Anthony,Fiction,,"Cal, Veg, and Aquilon try to escape from a dangerous world ruled by murderous robots and return to their own dimension",1976.0,3.43,256.0,805.0,Ox,"9780380004614 Cal, Veg, and Aquilon try to escape from a dangerous world ruled by murderous robots and return to their own dimension"
9780380707638,0380707632,Stephen Hawking's Universe,John Boslough,Biography & Autobiography,http://books.google.com/books/content?id=lkntNIwunAAC&printsec=frontcover&img=1&zoom=1&source=gbs_api,"Describes the theoretical work of the outstanding British physicist Stephen Hawking, who has done noteworthy work in cosmology.",1989.0,4.04,160.0,648.0,Stephen Hawking's Universe,"9780380707638 Describes the theoretical work of the outstanding British physicist Stephen Hawking, who has done noteworthy work in cosmology."
9780380711963,0380711966,Tim,Colleen McCullough,Fiction,http://books.google.com/books/content?id=kBFiyP7jOp4C&printsec=frontcover&img=1&zoom=1&source=gbs_api,"A highly intelligent, lonely, middle-aged spinster finds pure and innocent love in the arms of a simple-minded, young laborer",1990.0,3.81,288.0,150.0,Tim,"9780380711963 A highly intelligent, lonely, middle-aged spinster finds pure and innocent love in the arms of a simple-minded, young laborer"
9780380718122,038071812X,Lucie Babbidge's House,Sylvia Cassedy,Juvenile Fiction,http://books.google.com/books/content?id=5RyCPwAACAAJ&printsec=frontcover&img=1&zoom=1&source=gbs_api,"Having found a dollhouse full of dolls in the orphanage where she leads an unhappy existence, Lucie creates a secret life for herself.",1993.0,3.75,242.0,160.0,Lucie Babbidge's House,"9780380718122 Having found a dollhouse full of dolls in the orphanage where she leads an unhappy existence, Lucie creates a secret life for herself."
9780380810956,0380810956,The Wolves in the Walls,Neil Gaiman,Juvenile Fiction,http://books.google.com/books/content?id=Ksx1aCPS7CoC&printsec=frontcover&img=1&zoom=1&source=gbs_api,"Lucy hears sneaking, creeping, crumpling noises coming from inside the walls. She is sure there are wolves living in the walls of her house.",2005.0,4.07,56.0,13382.0,The Wolves in the Walls,"9780380810956 Lucy hears sneaking, creeping, crumpling noises coming from inside the walls. She is sure there are wolves living in the walls of her house."
9780385017336,0385017332,Love Poems and Sonnets of William Shakespeare,William Shakespeare,Drama,http://books.google.com/books/content?id=mSeeR6eVaa8C&printsec=frontcover&img=1&zoom=1&source=gbs_api,A compilation of Shakespeare's sonnets and love poems features color illustrations.,1991.0,4.34,160.0,5625.0,Love Poems and Sonnets of William Shakespeare,9780385017336 A compilation of Shakespeare's sonnets and love poems features color illustrations.
9780385040204,0385040202,Your Child's Self-esteem,Dorothy Corkille Briggs,Family & Relationships,http://books.google.com/books/content?id=klpvGJllL80C&printsec=frontcover&img=1&zoom=1&source=gbs_api,Discusses the ways in which parental attitudes shape the child's concept of himself and offers guidelines for creating positive relationships,1975.0,4.26,368.0,179.0,Your Child's Self-esteem: The Key to Life,9780385040204 Discusses the ways in which parental attitudes shape the child's concept of himself and offers guidelines for creating positive relationships
9780385074070,0385074077,Complete Stories and Poems of Edgar Allan Poe,Edgar Allan Poe,Fiction,http://books.google.com/books/content?id=gxXHOU5Ni6UC&printsec=frontcover&img=1&zoom=1&source=gbs_api,"A complete collection of the writings of Poe, including his mysteries, fantasies, satires, and poems",1966.0,4.38,821.0,174162.0,Complete Stories and Poems of Edgar Allan Poe,"9780385074070 A complete collection of the writings of Poe, including his mysteries, fantasies, satires, and poems"
9780385086165,0385086164,A Man of the People,Chinua Achebe,Fiction,http://books.google.com/books/content?id=wUNWVXxtFBgC&printsec=frontcover&img=1&zoom=1&source=gbs_api,A young intellectual becomes embroiled in the struggle of Nigerian revolutionaries,1966.0,3.87,160.0,3089.0,A Man of the People,9780385086165 A young intellectual becomes embroiled in the struggle of Nigerian revolutionaries
9780385121224,0385121229,Plagues and peoples,William Hardy McNeill,History,http://books.google.com/books/content?id=VzRin_YlpCAC&printsec=frontcover&img=1&zoom=1&source=gbs_api,A distinguished historian probes the critical impact of infectious diseases on the development of world civilizations,1998.0,3.9,368.0,3406.0,Plagues and peoples,9780385121224 A distinguished historian probes the critical impact of infectious diseases on the development of world civilizations
9780385189514,0385189516,The Complete Fairy Tales and Stories,"Andersen, H. C. (Hans Christian)",Fiction,http://books.google.com/books/content?id=S_ZvDwAAQBAJ&printsec=frontcover&img=1&zoom=1&source=gbs_api,Presents 156 tales accompanied by the author's notes on the background of his stories.,1983.0,4.28,1101.0,255.0,The Complete Fairy Tales and Stories,9780385189514 Presents 156 tales accompanied by the author's notes on the background of his stories.
9780385240871,0385240872,Lost in the Funhouse,John Barth,Fiction,http://books.google.com/books/content?id=T3y-OBKPxJsC&printsec=frontcover&img=1&zoom=1&source=gbs_api,Fourteen short literary experiments intended for perusal in sequence are set in contemporary society and classical Greece,1988.0,3.71,205.0,4899.0,"Lost in the Funhouse: Fiction for Print, Tape, Live Voice",9780385240871 Fourteen short literary experiments intended for perusal in sequence are set in contemporary society and classical Greece
9780385264587,0385264585,The Beginning and the End,Naguib Mahfouz;Najīb Maḥfūẓ,Fiction,http://books.google.com/books/content?id=nfZMDAAAQBAJ&printsec=frontcover&img=1&zoom=1&source=gbs_api,The sudden death of Kamel Effendi plunges his middle class family into poverty and a desperate struggle to survive.,1989.0,4.07,412.0,348.0,The Beginning and the End,9780385264587 The sudden death of Kamel Effendi plunges his middle class family into poverty and a desperate struggle to survive.
9780385313483,0385313489,The Last Lion,William Manchester,Biography & Autobiography,http://books.google.com/books/content?id=uxOzxgEACAAJ&printsec=frontcover&img=1&zoom=1&source=gbs_api,Describes the early life and political career of the British prime minister.,1984.0,4.43,992.0,8986.0,"The Last Lion: Winston Spencer Churchill - Visions of Glory, 1874-1932",9780385313483 Describes the early life and political career of the British prime minister.
9780385333474,0385333471,"God Bless You, Mr. Rosewater",Kurt Vonnegut,Fiction,http://books.google.com/books/content?id=XVsu8qFi87AC&printsec=frontcover&img=1&zoom=1&source=gbs_api,A lawyer schemes to gain control of a large fortune by having the present claimant declared insane.,1998.0,3.96,288.0,40488.0,"God Bless You, Mr. Rosewater: Or, Pearls Before Swine",9780385333474 A lawyer schemes to gain control of a large fortune by having the present claimant declared insane.
9780385333504,0385333501,Welcome to the Monkey House,Kurt Vonnegut,Fiction,http://books.google.com/books/content?id=vkj0QEE0uRUC&printsec=frontcover&img=1&zoom=1&source=gbs_api,"Tender stories of love, incisive essays on human greed and misery, and imaginative tales of futuristic happenings reveal Vonnegut's versatility and vision",1968.0,4.14,331.0,44749.0,Welcome to the Monkey House: A Collection of Short Works,"9780385333504 Tender stories of love, incisive essays on human greed and misery, and imaginative tales of futuristic happenings reveal Vonnegut's versatility and vision"
9780385333511,038533351X,Bluebeard,Kurt Vonnegut,Fiction,http://books.google.com/books/content?id=4SZY-ylikTIC&printsec=frontcover&img=1&zoom=1&source=gbs_api,"An autobiography of Rabo Karabekian, an abstract expressionist artist, who acquired the largest collection of abstract expressionist paintings in private hands.",1998.0,4.03,318.0,29644.0,Bluebeard,"9780385333511 An autobiography of Rabo Karabekian, an abstract expressionist artist, who acquired the largest collection of abstract expressionist paintings in private hands."
9780385334174,0385334176,Deadeye Dick,Kurt Vonnegut,Fiction,http://books.google.com/books/content?id=mUmNDQAAQBAJ&printsec=frontcover&img=1&zoom=1&source=gbs_api,A young boy's life is irrevocably changed when he accidently kills a pregnant woman while playing with one of his father's many rifles,1999.0,3.81,271.0,21076.0,Deadeye Dick,9780385334174 A young boy's life is irrevocably changed when he accidently kills a pregnant woman while playing with one of his father's many rifles
9780385334303,0385334303,The Naked Ape,Desmond Morris,Science,http://books.google.com/books/content?id=CS-GPwAACAAJ&printsec=frontcover&img=1&zoom=1&source=gbs_api,"Examines sex, child rearing, fighing, feeding habits, and exploration of man in an attempt to establish bonds with the animal kingdom",1999.0,3.95,256.0,6479.0,The Naked Ape: A Zoologist's Study of the Human Animal,"9780385334303 Examines sex, child rearing, fighing, feeding habits, and exploration of man in an attempt to establish bonds with the animal kingdom"
9780385335102,0385335105,Aches & Pains,Maeve Binchy,Humor,http://books.google.com/books/content?id=D8CPSJ-g3XIC&printsec=frontcover&img=1&zoom=1&source=gbs_api,"Takes a humorous view of medical care, hospital stays, and convalescence.",2000.0,3.54,99.0,337.0,Aches & Pains,"9780385335102 Takes a humorous view of medical care, hospital stays, and convalescence."
9780385337816,0385337817,Coming of Age in Mississippi,Anne Moody,Biography & Autobiography,http://books.google.com/books/content?id=1y1dyH1C_QIC&printsec=frontcover&img=1&zoom=1&source=gbs_api,Anne Moody provides a first person account of growing up black in the rural South during the nineteen forties and fifties.,1968.0,4.13,424.0,6824.0,Coming of Age in Mississippi,9780385337816 Anne Moody provides a first person account of growing up black in the rural South during the nineteen forties and fifties.
9780385337939,0385337930,A Painted House,John Grisham,Fiction,http://books.google.com/books/content?id=PKKsy1PSK-UC&printsec=frontcover&img=1&zoom=1&source=gbs_api,"Racial tension, a forbidden love affair, and murder are seen through the eyes of a seven-year-old boy in a 1950s Southern cotton-farming community.",2004.0,3.69,384.0,65551.0,A Painted House,"9780385337939 Racial tension, a forbidden love affair, and murder are seen through the eyes of a seven-year-old boy in a 1950s Southern cotton-farming community."
9780385418133,0385418132,The Art of Alfred Hitchcock,"Donald Spoto;Donald Spoto, M.A., Ph.D.",Performing Arts,http://books.google.com/books/content?id=pnMEkW_JjfMC&printsec=frontcover&img=1&zoom=1&source=gbs_api,This completely revised and updated edition of the classic text describes and analyzes every movie made by master filmmaker Alfred Hitchcock.,1992.0,4.08,496.0,456.0,The Art of Alfred Hitchcock: Fifty Years of His Motion Pictures,9780385418133 This completely revised and updated edition of the classic text describes and analyzes every movie made by master filmmaker Alfred Hitchcock.
